{
  "schema_version": "2.0",
  "seed": 42,
  "target_count": 50,
  "market": {
    "country": "US",
    "language": "en",
    "currency": "USD"
  },
  "market_provenance": {
    "basis": "assumption",
    "source_ids": [],
    "finding_ids": [],
    "note": "US English USD demo scenario, not confirmed audience geography."
  },
  "allocation_basis": "scenario_coverage_not_market_share",
  "product_id": "sony-speaker",
  "population_version": "sony-research-v2-manual-1",
  "attributes": {
    "repair_confidence": {
      "type": "string",
      "unit": null,
      "description": "Ability and willingness to arrange repair"
    },
    "existing_battery_hours": {
      "type": "integer",
      "unit": "hours",
      "description": "Assumed present useful battery endurance"
    },
    "required_session_hours": {
      "type": "integer",
      "unit": "hours",
      "description": "Intended listening session"
    },
    "maximum_carry_weight_g": {
      "type": "integer",
      "unit": "g",
      "description": "Carrying constraint independent of offered speaker"
    },
    "current_satisfaction": {
      "type": "string",
      "unit": null,
      "description": "Satisfaction with existing solution"
    },
    "charging_access": {
      "type": "string",
      "unit": null,
      "description": "Access to power during listening"
    },
    "battery_hours_up_to": {
      "type": "number",
      "unit": "hours",
      "description": "Advertised maximum; not guaranteed session duration"
    },
    "weight_g": {
      "type": "number",
      "unit": "g",
      "description": "Offer mass"
    },
    "serviceability": {
      "type": "string",
      "unit": null,
      "description": "Repair access and ongoing parts availability need evidence"
    }
  },
  "segments": [
    {
      "segment_id": "repair-hesitant",
      "name": "Aging-speaker owners reluctant to repair",
      "goal": "Restore dependable portable listening without a difficult repair.",
      "count": 13,
      "rationale": {
        "basis": "market_evidence",
        "source_ids": [
          "battery-request",
          "repair-retain"
        ],
        "finding_ids": [
          "serviceability-request",
          "repair-friction"
        ],
        "note": "Qualitative situation suggested by self-reports; grouping, boundaries and count remain authored assumptions. Not prevalence or willingness to pay."
      },
      "fields": {
        "purchase_trigger": {
          "rule": {
            "kind": "choice",
            "values": [
              "Battery no longer lasts the intended session"
            ]
          },
          "provenance": {
            "basis": "assumption",
            "source_ids": [],
            "finding_ids": [],
            "note": "Authored scenario range or relationship for coverage; not a measured buyer distribution."
          }
        },
        "current_solution": {
          "rule": {
            "kind": "choice",
            "values": [
              "Aging portable speaker with short battery endurance"
            ]
          },
          "provenance": {
            "basis": "assumption",
            "source_ids": [],
            "finding_ids": [],
            "note": "Authored scenario range or relationship for coverage; not a measured buyer distribution."
          }
        },
        "budget.maximum": {
          "rule": {
            "kind": "integer",
            "minimum": 60,
            "maximum": 180
          },
          "provenance": {
            "basis": "assumption",
            "source_ids": [],
            "finding_ids": [],
            "note": "Authored scenario range or relationship for coverage; not a measured buyer distribution."
          }
        },
        "budget.comfortable": {
          "rule": {
            "kind": "scale",
            "field": "budget.maximum",
            "factor": 0.75,
            "round": "floor"
          },
          "provenance": {
            "basis": "assumption",
            "source_ids": [],
            "finding_ids": [],
            "note": "Authored scenario range or relationship for coverage; not a measured buyer distribution."
          }
        },
        "budget.currency": {
          "rule": {
            "kind": "constant",
            "value": "USD"
          },
          "provenance": {
            "basis": "assumption",
            "source_ids": [],
            "finding_ids": [],
            "note": "Authored scenario range or relationship for coverage; not a measured buyer distribution."
          }
        },
        "budget.billing_period": {
          "rule": {
            "kind": "constant",
            "value": "one_time"
          },
          "provenance": {
            "basis": "assumption",
            "source_ids": [],
            "finding_ids": [],
            "note": "Authored scenario range or relationship for coverage; not a measured buyer distribution."
          }
        },
        "budget.scope_units": {
          "rule": {
            "kind": "constant",
            "value": 1
          },
          "provenance": {
            "basis": "assumption",
            "source_ids": [],
            "finding_ids": [],
            "note": "Authored scenario range or relationship for coverage; not a measured buyer distribution."
          }
        },
        "budget.upfront_maximum": {
          "rule": {
            "kind": "reference",
            "field": "budget.maximum"
          },
          "provenance": {
            "basis": "assumption",
            "source_ids": [],
            "finding_ids": [],
            "note": "Authored scenario range or relationship for coverage; not a measured buyer distribution."
          }
        },
        "budget.scope_note": {
          "rule": {
            "kind": "constant",
            "value": "One portable speaker or repair alternative; taxes, shipping and optional spare must be considered separately."
          },
          "provenance": {
            "basis": "assumption",
            "source_ids": [],
            "finding_ids": [],
            "note": "Authored scenario range or relationship for coverage; not a measured buyer distribution."
          }
        },
        "urgency.deadline_days": {
          "rule": {
            "kind": "choice",
            "values": [
              7,
              14,
              30
            ]
          },
          "provenance": {
            "basis": "assumption",
            "source_ids": [],
            "finding_ids": [],
            "note": "Authored scenario range or relationship for coverage; not a measured buyer distribution."
          }
        },
        "urgency.basis": {
          "rule": {
            "kind": "constant",
            "value": "Assumed time horizon"
          },
          "provenance": {
            "basis": "assumption",
            "source_ids": [],
            "finding_ids": [],
            "note": "Authored scenario range or relationship for coverage; not a measured buyer distribution."
          }
        },
        "tradeoffs": {
          "rule": {
            "kind": "choice",
            "values": [
              [
                {
                  "attribute": "total_cost",
                  "weight": 0.5
                },
                {
                  "attribute": "serviceability_evidence",
                  "weight": 0.3
                },
                {
                  "attribute": "repair_effort",
                  "weight": 0.2
                }
              ],
              [
                {
                  "attribute": "total_cost",
                  "weight": 0.3
                },
                {
                  "attribute": "serviceability_evidence",
                  "weight": 0.4
                },
                {
                  "attribute": "repair_effort",
                  "weight": 0.3
                }
              ]
            ]
          },
          "provenance": {
            "basis": "assumption",
            "source_ids": [],
            "finding_ids": [],
            "note": "Authored scenario range or relationship for coverage; not a measured buyer distribution."
          }
        },
        "decision_style.research_effort": {
          "rule": {
            "kind": "choice",
            "values": [
              "low",
              "medium",
              "high"
            ]
          },
          "provenance": {
            "basis": "assumption",
            "source_ids": [],
            "finding_ids": [],
            "note": "Authored scenario range or relationship for coverage; not a measured buyer distribution."
          }
        },
        "decision_style.evidence_need": {
          "rule": {
            "kind": "choice",
            "values": [
              "basic",
              "comparison",
              "independent"
            ]
          },
          "provenance": {
            "basis": "assumption",
            "source_ids": [],
            "finding_ids": [],
            "note": "Authored scenario range or relationship for coverage; not a measured buyer distribution."
          }
        },
        "decision_style.category_familiarity": {
          "rule": {
            "kind": "choice",
            "values": [
              "low",
              "medium",
              "high"
            ]
          },
          "provenance": {
            "basis": "assumption",
            "source_ids": [],
            "finding_ids": [],
            "note": "Authored scenario range or relationship for coverage; not a measured buyer distribution."
          }
        },
        "decision_style.evaluation_action_budget": {
          "rule": {
            "kind": "choice",
            "values": [
              3,
              4,
              5
            ]
          },
          "provenance": {
            "basis": "assumption",
            "source_ids": [],
            "finding_ids": [],